{
  "identity": {
    "case_id": "GOLD-FWD-R1-009-R3",
    "origin_case_id": "FWD-R1-009",
    "status": "gold",
    "revision": 3,
    "approved_by_user": true,
    "reviewed_at": "2026-09-01",
    "profile_revision_at_review": "round-5-inline-alignment-aemp"
  },
  "task": {
    "audience": "zero_prior_knowledge",
    "augmentation": "TEACHING",
    "base_operation": "EXPLAIN",
    "case_id": "FWD-R1-009",
    "components": [
      "CODE",
      "TEXT"
    ],
    "genre": "code_explanation",
    "references": [
      {
        "content": "values 应当是可逐项读取的数值集合；limit 是比较阈值；函数返回严格大于阈值的元素数量",
        "id": "REF-001"
      }
    ],
    "request": "保留原始 Python 代码，逐步解释输入、循环、条件、输出、运行方法和证据边界",
    "round": 1,
    "source": {
      "content": "def count_large(values, limit):\n    total = 0\n    for value in values:\n        if value > limit:\n            total += 1\n    return total",
      "material_type": "code",
      "sha256": "c1568800f936a18810fd614a60fedfee6fbeeb44e0e17092e8eac1efcdcac8c7"
    }
  },
  "source": {
    "original_request_sha256": "55f730746d2287ce3e57f6f12f4006b9b390bb56d73ea074cc6a96e2195a6822",
    "original_answer_sha256": "6cd997bde266b12bb3ef8a4485caa99aa957dc0182f0b9011fdca2bf746e2b2f",
    "source_units": [
      "SRCU-001",
      "SRCU-002",
      "SRCU-003",
      "SRCU-004",
      "SRCU-005",
      "SRCU-006"
    ],
    "support_map": [
      "SRCU-001",
      "SRCU-002",
      "SRCU-003",
      "SRCU-004",
      "SRCU-005",
      "SRCU-006"
    ],
    "background_claims": [
      {
        "claim": "values 应当是可逐项读取的数值集合",
        "source_reference": "REF-001"
      },
      {
        "claim": "limit 是比较阈值",
        "source_reference": "REF-001"
      },
      {
        "claim": "函数返回严格大于阈值的元素数量",
        "source_reference": "REF-001"
      },
      {
        "claim": "Python 是一种编程语言",
        "source_reference": "TERM-PYTHON-ROUND4"
      }
    ],
    "revision_references": [
      {
        "id": "TERM-PYTHON-ROUND4",
        "kind": "term_registry",
        "content": "Python 是一种编程语言，函数可以接收输入并返回结果"
      },
      {
        "id": "USER-ROUND4-FWD-009",
        "kind": "explicit_user_review",
        "content": "所有可注释语句的同行注释从最长代码行之后的同一列开始；代码注释已经说明的逐行内容不得在正文重复"
      }
    ]
  },
  "artifact": {
    "answer": "原始 Python 代码如下\n\n```python\ndef count_large(values, limit):\n    total = 0\n    for value in values:\n        if value > limit:\n            total += 1\n    return total\n```\n\n下面保留同一段代码并加入同行注释；每个注释都从最长代码行之后的同一列开始，代码逻辑没有改变\n\n```python\ndef count_large(values, limit): # 定义函数；values 提供待检查数值，limit 提供比较阈值\n    total = 0                   # 创建计数器并从 0 开始，只记录满足条件的元素数量\n    for value in values:        # 依次读取 values 中的每个元素，直到全部处理完成\n        if value > limit:       # 只在当前元素严格大于 limit 时进入下一行，等于时不计数\n            total += 1          # 把计数器增加 1，表示又发现一个满足条件的元素\n    return total                # 返回最终计数，这行本身不会把结果显示在屏幕上\n```\n\n在 Python 环境中先执行代码定义函数，再调用 `count_large(values, limit)`\n\n原始材料没有给出实际输入，因此无法计算具体结果；代码也没有规定不合格输入的处理方式，需要用字符串、空值或不可比较对象补充测试才能确认失败表现",
    "answer_sha256": "d24e653ef483eef41f3d7d5180476ce37b29adb2733b563a167ce609e71031d5",
    "approved_snapshot_sha256": "d24e653ef483eef41f3d7d5180476ce37b29adb2733b563a167ce609e71031d5",
    "revision_of": "REJECTED-FWD-R1-009-R2"
  },
  "review": {
    "decision_source": "explicit_user_review",
    "decision": "accepted",
    "reasons": [
      "CANDIDATE-FWD-R1-009-R3 可以，没问题"
    ],
    "correct_parts": [
      "原始答案中未被用户否定的事实、数字、条件和证据边界继续保留"
    ],
    "regression_requirements": [
      "所有可注释语句的同行注释从最长代码行之后的同一列开始",
      "代码注释已经说明的逐行内容不得在正文重复"
    ],
    "non_blocking_preferences": [],
    "privacy": {
      "status": "public_safe",
      "basis": "只保存脱敏技术反馈，不保存原始对话、账户信息或个人路径"
    }
  }
}
