{
  "identity": {
    "case_id": "CANDIDATE-FWD-R1-012-R3",
    "origin_case_id": "FWD-R1-012",
    "status": "candidate",
    "revision": 3,
    "approved_by_user": false,
    "reviewed_at": null,
    "profile_revision_at_review": null
  },
  "task": {
    "audience": "zero_prior_knowledge",
    "augmentation": "EXPLANATORY",
    "base_operation": "TRANSLATE",
    "case_id": "FWD-R1-012",
    "components": [
      "TEXT"
    ],
    "genre": "academic_text",
    "references": [
      {
        "content": "地层中较高的沉积层通常形成得更晚；火山灰层可以通过适当的同位素方法测年；上覆层的年龄只限制埋藏事件不能晚于该层形成时间",
        "id": "REF-001"
      }
    ],
    "request": "完整翻译并补充理解这一地质过程所需的背景，明确区分原文结论和补充解释",
    "round": 1,
    "source": {
      "content": "The dated ash layer lies above the fossil bed. It therefore sets a minimum age for the burial event, but it does not establish how long the organisms lived before burial.",
      "material_type": "text",
      "sha256": "4e0ba50aa591cde083ecb320f943d4a31c04651eab8e27f933626c7728360081"
    }
  },
  "source": {
    "original_request_sha256": "7b9ec7ce8908eb53b46bcfab0bf4ded3b12e3aa729603f94eb8ee4329a93c785",
    "original_answer_sha256": "af25485a06f0605e26f05d0e253afddeaec11e8af7191dc814c6fc6ba080b792",
    "source_units": [
      "SRCU-001",
      "SRCU-002",
      "SRCU-003"
    ],
    "support_map": [
      "SRCU-001",
      "SRCU-002",
      "SRCU-003"
    ],
    "background_claims": [
      {
        "claim": "地层中较高的沉积层通常形成得更晚",
        "source_reference": "REF-001"
      },
      {
        "claim": "火山灰层可以通过适当的同位素方法测年",
        "source_reference": "REF-001"
      },
      {
        "claim": "上覆层的年龄只限制埋藏事件不能晚于该层形成时间",
        "source_reference": "REF-001"
      },
      {
        "claim": "地层的官方英文类别是 Stratum",
        "source_reference": "TERM-GEOLOGY-ROUND4"
      },
      {
        "claim": "火山灰层的官方英文名称是 Volcanic Ash Layer",
        "source_reference": "TERM-GEOLOGY-ROUND4"
      },
      {
        "claim": "化石层的官方英文名称是 Fossil Bed",
        "source_reference": "TERM-GEOLOGY-ROUND4"
      },
      {
        "claim": "最低年龄的官方英文名称是 Minimum Age",
        "source_reference": "TERM-GEOLOGY-ROUND4"
      }
    ],
    "revision_references": [
      {
        "id": "TERM-GEOLOGY-ROUND4",
        "kind": "term_registry",
        "content": "地层、火山灰层、化石层和最低年龄的术语形式与当前语境定义"
      },
      {
        "id": "USER-ROUND4-FWD-012",
        "kind": "explicit_user_review",
        "content": "增加不需要地质学知识也能理解的普通解释；继续区分原文结论和补充背景"
      }
    ]
  },
  "artifact": {
    "answer": "# 原文结论\n\n已经测定年代的火山灰层位于化石层上方，因此这个年代为埋藏事件确定了最低年龄；不过，这个年代不能说明这些生物在被埋藏以前生活了多长时间\n\n# 不需要地质学知识的理解方式\n\n可以把这些地层想成先后叠放的几层材料；化石层在下面，火山灰层后来覆盖在上面，因此下面的埋藏事件一定发生得更早\n\n测得上方火山灰层的年代以后，只能确认埋藏事件至少已经发生了这么久；埋藏也可能更早，所以这个结果叫作最低年龄\n\n# 补充背景\n\n* 地层（Stratum）：地质过程中逐层形成的岩石或沉积物；上下位置可以帮助判断形成先后\n* 火山灰层（Volcanic Ash Layer）：火山喷发后沉积形成的灰层；合适的同位素方法可以测定它的形成年代\n* 化石层（Fossil Bed）：包含化石的地层；这里记录了生物被埋藏的位置\n* 最低年龄（Minimum Age）：事件至少已经发生了这么久，但实际时间可以更早\n\n测年的对象是化石层上方的火山灰层，不是生物本身；这些信息只能限制埋藏事件的时间，不能据此推断生物在埋藏以前存活了多久",
    "answer_sha256": "b5212c278ea35905313b2c11d62bf5f827e82f9fbd53d55749d22d5a03e785f6",
    "approved_snapshot_sha256": null,
    "revision_of": "REJECTED-FWD-R1-012-R2"
  },
  "review": {
    "decision_source": "pending_user_review",
    "decision": "pending",
    "reasons": [
      "R3 已按照第四轮用户反馈修订，等待用户逐项审核"
    ],
    "correct_parts": [
      "原始答案中未被用户否定的事实、数字、条件和证据边界继续保留"
    ],
    "regression_requirements": [
      "增加不需要地质学知识也能理解的普通解释",
      "继续区分原文结论和补充背景"
    ],
    "non_blocking_preferences": [],
    "privacy": {
      "status": "public_safe",
      "basis": "只保存脱敏技术反馈，不保存原始对话、账户信息或个人路径"
    }
  }
}
