{
  "identity": {
    "case_id": "CANDIDATE-FWD-R2-031-R1",
    "origin_case_id": "FWD-R2-031",
    "status": "candidate",
    "revision": 1,
    "approved_by_user": false,
    "reviewed_at": null,
    "profile_revision_at_review": null
  },
  "task": {
    "audience": "zero_prior_knowledge",
    "augmentation": "EXPLANATORY",
    "base_operation": "TRANSFORM",
    "case_id": "FWD-R2-031",
    "components": [
      "TEXT"
    ],
    "content_task": "reference",
    "core_terms": [
      "sample_age_ms",
      "quality_flag"
    ],
    "genre": "api_reference",
    "input_char_count": 465,
    "length_class": "medium",
    "references": [
      {
        "content": "stale 表示样本超过设备配置的时效阈值；接口材料没有提供该阈值的具体毫秒数。",
        "id": "REF-001"
      },
      {
        "content": "复核编号 B31，须保留",
        "id": "REF-RESTART"
      },
      {
        "content": "核对段1（事实归属）：value 是数值或受条件约束的空值；本段只支持这项陈述，不能替代其他段落的条件或证据。核对段2（条件边界）：sample_age_ms 的单位为毫秒；本段只支持这项陈述，不能替代其他段落的条件或证据。核对段3（数值范围）：quality_flag 有 ok、stale、missing 三种；本段只支持这项陈述，不能替代其他段落的条件或证据。",
        "id": "REF-COVERAGE"
      }
    ],
    "request": "改写为技术人员可查阅的字段参考，保留单位和空值语义",
    "round": 2,
    "source": {
      "content": "payload: value number; sample_age_ms integer; quality_flag ok|stale|missing; value=null only when quality_flag=missing. sample_age_ms is measured when the response is created, not when the client reads it.",
      "material_type": "text",
      "sha256": "af7b90b1a01c25e475a1c3083044962138642ba691149406eb870d0895655bf1"
    },
    "topic_id": "TOPIC-R2-031",
    "variation_tags": [
      "mixed_format",
      "distributed_condition",
      "negation_exception"
    ]
  },
  "source": {
    "original_request_sha256": "96c5537e2e53bdbb2c05c6f212df575cb4a0596706f153f51a2dc0986dd0edd3",
    "original_answer_sha256": "875f2119e1db1d774882aae18caae6f7be494ae28e5e3999b87be2dff1e343ba",
    "source_units": [
      "SRCU-001",
      "SRCU-002",
      "SRCU-003",
      "SRCU-004",
      "SRCU-005",
      "SRCU-006",
      "SRCU-007",
      "SRCU-008",
      "SRCU-009",
      "SRCU-010",
      "SRCU-011"
    ],
    "support_map": [
      "SRCU-001",
      "SRCU-002",
      "SRCU-003",
      "SRCU-004",
      "SRCU-005",
      "SRCU-006",
      "SRCU-007",
      "SRCU-008",
      "SRCU-009",
      "SRCU-010",
      "SRCU-011"
    ],
    "background_claims": [
      {
        "claim": "stale 表示样本超过设备配置的时效阈值；接口材料没有提供该阈值的具体毫秒数。",
        "source_reference": "REF-001"
      },
      {
        "claim": "复核编号为 B31。",
        "source_reference": "REF-RESTART"
      },
      {
        "claim": "value 是数值或受 quality_flag=missing 条件约束的空值。",
        "source_reference": "REF-COVERAGE"
      },
      {
        "claim": "sample_age_ms 的单位为毫秒。",
        "source_reference": "REF-COVERAGE"
      },
      {
        "claim": "quality_flag 有 ok、stale、missing 三种取值。",
        "source_reference": "REF-COVERAGE"
      }
    ],
    "revision_references": []
  },
  "artifact": {
    "answer": "## `payload` 字段参考\n\n`payload` 包含以下三个字段：\n\n- `value`\n  - 类型：`number | null`\n  - 含义：样本数值\n  - 空值规则：仅当 `quality_flag=missing` 时，`value` 才允许为 `null`\n  - 注意：上述规则表示 `value=null` 必须对应 `quality_flag=missing`，并不表示 `quality_flag=missing` 时 `value` 一定为 `null`\n\n- `sample_age_ms`\n  - 类型：`integer`\n  - 单位：毫秒（`ms`）\n  - 含义：样本在接口生成响应时的年龄\n  - 计时点：该值在响应创建时测量，不是在客户端读取响应时测量\n\n- `quality_flag`\n  - 可选值：`ok`、`stale`、`missing`\n  - `stale`：样本已超过设备配置的时效阈值\n  - 阈值边界：现有接口材料未提供该阈值的具体毫秒数\n\n复核编号：B31",
    "answer_sha256": "875f2119e1db1d774882aae18caae6f7be494ae28e5e3999b87be2dff1e343ba",
    "approved_snapshot_sha256": null,
    "revision_of": null
  },
  "review": {
    "decision_source": "pending_user_review",
    "decision": "pending",
    "reasons": [],
    "correct_parts": [],
    "regression_requirements": [],
    "non_blocking_preferences": [],
    "privacy": {
      "status": "public_safe",
      "basis": "全新合成评测主题，不含用户、服务器、私有项目或凭据数据"
    }
  }
}
