{
  "identity": {
    "case_id": "GOLD-FWD-R1-016",
    "origin_case_id": "FWD-R1-016",
    "status": "gold",
    "revision": 1,
    "approved_by_user": true,
    "reviewed_at": "2026-08-31",
    "profile_revision_at_review": "round-3-capitalization"
  },
  "task": {
    "audience": "zero_prior_knowledge",
    "augmentation": "NONE",
    "base_operation": "FORMAT_ONLY",
    "case_id": "FWD-R1-016",
    "components": [
      "TEXT"
    ],
    "genre": "meeting_record",
    "references": [],
    "request": "只整理标题、分组和缩进；禁止改写结论或补充缺失负责人",
    "round": 1,
    "source": {
      "content": "评审记录 结论 保留旧接口到10月15日 新接口10月1日开放 兼容性 安卓12已验证 安卓11未验证 后续 安卓11测试负责人未确定 文档由陈澄9月28日前更新",
      "material_type": "text",
      "sha256": "94e3a2addd6fa0347423a0c1266b9faca46367c52d9693edff12a0e80e3effe1"
    }
  },
  "source": {
    "original_request_sha256": "be916c8c94b82c17b797cefe91bacf751f4563697df4e0f291236b9f1e520146",
    "original_answer_sha256": "a1798c188488985d3feea246537aeb80cd46bf1695db0746d30b4621280be8cd",
    "source_units": [
      "SRCU-001",
      "SRCU-002",
      "SRCU-003",
      "SRCU-004",
      "SRCU-005",
      "SRCU-006",
      "SRCU-007"
    ],
    "support_map": [
      "SRCU-001",
      "SRCU-002",
      "SRCU-003",
      "SRCU-004",
      "SRCU-005",
      "SRCU-006",
      "SRCU-007"
    ],
    "background_claims": [],
    "revision_references": []
  },
  "artifact": {
    "answer": "# 评审记录\n\n## 结论\n\n- 保留旧接口到10月15日\n- 新接口10月1日开放\n\n## 兼容性\n\n- 安卓12已验证\n- 安卓11未验证\n\n## 后续\n\n- 安卓11测试负责人未确定\n- 文档由陈澄9月28日前更新",
    "answer_sha256": "a1798c188488985d3feea246537aeb80cd46bf1695db0746d30b4621280be8cd",
    "approved_snapshot_sha256": "a1798c188488985d3feea246537aeb80cd46bf1695db0746d30b4621280be8cd",
    "revision_of": null
  },
  "review": {
    "decision_source": "explicit_user_review",
    "decision": "accepted",
    "reasons": [
      "用户明确表示原始答案可以原样接受"
    ],
    "correct_parts": [
      "原始答案中未被用户否定的事实、数字、条件和证据边界继续保留"
    ],
    "regression_requirements": [],
    "non_blocking_preferences": [],
    "privacy": {
      "status": "public_safe",
      "basis": "只保存脱敏技术反馈，不保存原始对话、账户信息或个人路径"
    }
  }
}
