{
  "identity": {
    "case_id": "CANDIDATE-FWD-R1-005-R2",
    "origin_case_id": "FWD-R1-005",
    "status": "candidate",
    "revision": 2,
    "approved_by_user": false,
    "reviewed_at": null,
    "profile_revision_at_review": null
  },
  "task": {
    "audience": "zero_prior_knowledge",
    "augmentation": "GLOSS",
    "base_operation": "GENERATE",
    "case_id": "FWD-R1-005",
    "components": [
      "TEXT"
    ],
    "genre": "setup_guide",
    "references": [
      {
        "content": "长按设备侧键 3 秒进入配对；指示灯蓝色闪烁；手机系统设置中选择 Thermo Mini；连接成功后指示灯常亮 5 秒；若 60 秒内未连接，设备退出配对",
        "id": "REF-001"
      }
    ],
    "request": "根据给定事实写一份蓝牙温度计首次配对说明，读者没有使用经验",
    "round": 1,
    "source": {
      "content": "",
      "material_type": "none",
      "sha256": "e3b0c44298fc1c149afbf4c8996fb92427ae41e4649b934ca495991b7852b855"
    }
  },
  "source": {
    "original_request_sha256": "da68d8bbdfde84431e0a514171bd3c744542e0e492eaf93fcf6989956c8252aa",
    "original_answer_sha256": "84a9c6cca6fd5f6e0be12b232e08009ea5654984a3cf5581667d5afeae3ece9f",
    "source_units": [],
    "support_map": [],
    "background_claims": [
      {
        "claim": "长按设备侧键 3 秒进入配对",
        "source_reference": "REF-001"
      },
      {
        "claim": "进入配对后指示灯蓝色闪烁",
        "source_reference": "REF-001"
      },
      {
        "claim": "在手机系统设置中选择 Thermo Mini",
        "source_reference": "REF-001"
      },
      {
        "claim": "连接成功后指示灯常亮 5 秒",
        "source_reference": "REF-001"
      },
      {
        "claim": "若 60 秒内未连接，设备退出配对",
        "source_reference": "REF-001"
      }
    ],
    "revision_references": []
  },
  "artifact": {
    "answer": "# Thermo Mini 首次配对\n\n下面的流程分别显示配对成功和超时退出两种结果\n\n```mermaid\nflowchart TD\n    A[长按设备侧键 3 秒] --> B[指示灯蓝色闪烁]\n    B --> C[在手机系统设置中选择 Thermo Mini]\n    C --> D{60 秒内是否连接成功}\n    D -- 是 --> E[指示灯常亮 5 秒]\n    D -- 否 --> F[设备退出配对]\n```\n\n<p align=\"center\">图 1. Thermo Mini 首次配对流程</p>\n\n图中的流程从长按设备侧键开始；蓝色闪烁表示设备已经进入可配对状态，手机随后需要在系统设置中选择 `Thermo Mini`；连接成功时，指示灯会常亮 5 秒，60 秒内没有连接时，设备会退出配对并返回开始步骤\n\n1. 长按设备侧键 3 秒\n   - 看到指示灯蓝色闪烁后再继续；这个现象表示设备已经进入配对状态\n2. 在手机系统设置中选择 `Thermo Mini`\n   - 这一步让手机向当前设备发起连接\n3. 查看指示灯\n   - 指示灯常亮 5 秒表示连接成功\n   - 60 秒内没有连接表示本次配对超时；设备退出配对后，需要从第一步重新开始",
    "answer_sha256": "f145155f45e0393fe0547f1138a71d9a30d4bad9414139b262ed7189b50cddad",
    "approved_snapshot_sha256": null,
    "revision_of": "REJECTED-FWD-R1-005"
  },
  "review": {
    "decision_source": "pending_user_review",
    "decision": "pending",
    "reasons": [
      "根据第一轮用户反馈完成修订，等待用户逐项审核"
    ],
    "correct_parts": [
      "原始答案中未被用户否定的事实、数字、条件和证据边界继续保留"
    ],
    "regression_requirements": [
      "步骤保持缩进编号列表",
      "GitHub 中的图题必须经过实际渲染确认居中"
    ],
    "non_blocking_preferences": [],
    "privacy": {
      "status": "public_safe",
      "basis": "只保存脱敏技术反馈，不保存原始对话、账户信息或个人路径"
    }
  }
}
