{
  "identity": {
    "case_id": "CANDIDATE-FWD-R2-035-R1",
    "origin_case_id": "FWD-R2-035",
    "status": "candidate",
    "revision": 1,
    "approved_by_user": false,
    "reviewed_at": null,
    "profile_revision_at_review": null
  },
  "task": {
    "audience": "auditor",
    "augmentation": "EXPLANATORY",
    "base_operation": "GENERATE",
    "case_id": "FWD-R2-035",
    "components": [
      "TEXT"
    ],
    "content_task": "tutorial",
    "core_terms": [
      "缓存键",
      "失效广播"
    ],
    "genre": "systems_tutorial",
    "input_char_count": 943,
    "length_class": "long",
    "references": [
      {
        "content": "写入服务提交数据库后发布失效广播；边缘节点按缓存键删除副本。广播最多重试 3 次，每次间隔 5 秒。节点离线时可能错过广播，但缓存最长 10 分钟自动过期。管理员可以按租户清除，不能按单个用户清除。监控只统计成功接收广播的在线节点。",
        "id": "REF-ARCH"
      },
      {
        "content": "复核编号 B35，须保留",
        "id": "REF-RESTART"
      },
      {
        "content": "核对段1（事实归属）：数据库提交发生在广播之前；本段只支持这项陈述，不能替代其他段落的条件或证据。核对段2（条件边界）：边缘节点按缓存键失效；本段只支持这项陈述，不能替代其他段落的条件或证据。核对段3（数值范围）：广播最多重试 3 次；本段只支持这项陈述，不能替代其他段落的条件或证据。核对段4（例外处理）：每次重试间隔 5 秒；本段只支持这项陈述，不能替代其他段落的条件或证据。核对段5（来源状态）：离线节点可能错过广播；本段只支持这项陈述，不能替代其他段落的条件或证据。核对段6（可验证结论）：缓存最长 10 分钟自动过期；本段只支持这项陈述，不能替代其他段落的条件或证据。核对段7（不可外推内容）：人工清除粒度是租户而不是用户；本段只支持这项陈述，不能替代其他段落的条件或证据。核对段8（复核提示）：监控统计不覆盖离线节点；本段只支持这项陈述，不能替代其他段落的条件或证据。核对段9（事实归属）：数据库提交发生在广播之前；本段只支持这项陈述，不能替代其他段落的条件或证据。核对段10（条件边界）：边缘节点按缓存键失效；本段只支持这项陈述，不能替代其他段落的条件或证据。核对段11（数值范围）：广播最多重试 3 次；本段只支持这项陈述，不能替代其他段落的条件或证据。核对段12（例外处理）：每次重试间隔 5 秒；本段只支持这项陈述，不能替代其他段落的条件或证据。核对段13（来源状态）：离线节点可能错过广播；本段只支持这项陈述，不能替代其他段落的条件或证据。核对段14（可验证结论）：缓存最长 10 分钟自动过期；本段只支持这项陈述，不能替代其他段落的条件或证据。核对段15（不可外推内容）：人工清除粒度是租户而不是用户；本段只支持这项陈述，不能替代其他段落的条件或证据。核对段16（复核提示）：监控统计不覆盖离线节点；本段只支持这项陈述，不能替代其他段落的条件或证据。",
        "id": "REF-COVERAGE"
      }
    ],
    "request": "根据事实写长教程，解释正常路径、失败路径、例外和排查顺序",
    "round": 2,
    "source": {
      "content": "",
      "material_type": "none",
      "sha256": "e3b0c44298fc1c149afbf4c8996fb92427ae41e4649b934ca495991b7852b855"
    },
    "topic_id": "TOPIC-R2-035",
    "variation_tags": [
      "distributed_condition",
      "mixed_format",
      "numeric_scope",
      "negation_exception"
    ]
  },
  "source": {
    "original_request_sha256": "70f3af15f5f7c3569b28bbd3a2306e4014a4b6b6a7aeb3b86159b706c03ae9c1",
    "original_answer_sha256": "77444dbb9a2a364db046955ffe9a7bdbc1b683e4607652c7ac937f4c9faa5bef",
    "source_units": [
      "SRCU-001",
      "SRCU-002",
      "SRCU-003",
      "SRCU-004",
      "SRCU-005",
      "SRCU-006",
      "SRCU-007",
      "SRCU-008",
      "SRCU-009",
      "SRCU-010",
      "SRCU-011",
      "SRCU-012",
      "SRCU-013",
      "SRCU-014",
      "SRCU-015",
      "SRCU-016",
      "SRCU-017",
      "SRCU-018",
      "SRCU-019",
      "SRCU-020",
      "SRCU-021",
      "SRCU-022",
      "SRCU-023",
      "SRCU-024",
      "SRCU-025"
    ],
    "support_map": [
      "SRCU-001",
      "SRCU-002",
      "SRCU-003",
      "SRCU-004",
      "SRCU-005",
      "SRCU-006",
      "SRCU-007",
      "SRCU-008",
      "SRCU-009",
      "SRCU-010",
      "SRCU-011",
      "SRCU-012",
      "SRCU-013",
      "SRCU-014",
      "SRCU-015",
      "SRCU-016",
      "SRCU-017",
      "SRCU-018",
      "SRCU-019",
      "SRCU-020",
      "SRCU-021",
      "SRCU-022",
      "SRCU-023",
      "SRCU-024",
      "SRCU-025"
    ],
    "background_claims": [],
    "revision_references": []
  },
  "artifact": {
    "answer": "# 缓存失效机制教程\n\n复核编号 B35，须保留\n\n## 一、先明确两个核心术语\n\n在本文所述系统中：\n\n- **缓存键**：边缘节点用来定位缓存副本的标识。节点收到失效通知后，按缓存键删除对应副本；现有材料没有说明缓存键的具体格式、组成字段或租户隔离方式\n- **失效广播**：写入服务在数据库提交后发布的通知，用来要求边缘节点删除指定缓存键对应的副本；它不是数据库提交本身，也不能代替数据库提交\n\n审计时必须固定因果顺序：先提交数据库，再发布失效广播。不能把两步写成同时发生，也不能把广播成功当作数据库已经提交的唯一证据\n\n## 二、正常路径\n\n正常路径按以下顺序理解：\n\n1. 写入服务提交数据库\n2. 数据库提交完成后，写入服务发布失效广播\n3. 在线边缘节点接收广播\n4. 成功接收广播的节点按缓存键删除本地副本\n5. 监控统计成功接收广播的在线节点\n\n这条路径能够说明数据写入与缓存删除的先后关系，但不能据此推断所有在线节点都一定成功接收，也不能推断离线节点已完成失效。监控数字只覆盖“在线且成功接收”的节点，不覆盖离线节点\n\n## 三、广播失败与重试路径\n\n广播未成功送达时，系统最多重试 3 次，每次重试间隔 5 秒。排查时应分别核对重试次数与时间间隔，不能只看到一次后续发送就认定完整重试策略已经执行\n\n现有材料没有说明：\n\n- “最多重试 3 次”是否之外还存在一次初始发送，因此不能仅凭该数字推导总发送次数\n- 什么条件触发重试\n- 每次重试面向全部节点还是部分节点\n- 重试结束后是否还有其他补偿机制\n\n因此，审计结论应限制为：已知广播最多重试 3 次，且每次间隔 5 秒；不能扩写为广播最终一定送达，也不能把重试次数直接换算成确定的整体恢复时长\n\n## 四、节点离线时的失败路径\n\n边缘节点离线时可能错过失效广播。这里的“可能”必须保留，它说明存在风险，不等于每个离线节点必然错过，也不表示离线节点会被监控计入失败\n\n即使节点错过广播，缓存仍有最长 10 分钟的自动过期限制。这提供了一条独立于广播接收结果的过期边界，但不能把它解释成节点已经收到广播，也不能直接断言数据库提交后整整 10 分钟缓存才过期，因为材料没有给出缓存过期计时的起点和剩余时长\n\n排查离线节点时，应区分两个问题：\n\n- 广播路径：节点是否在线并成功接收失效广播\n- 自动过期路径：对应缓存是否已经到达最长 10 分钟的过期边界\n\n监控只统计成功接收广播的在线节点，所以它不能证明离线节点是否错过广播，也不能单独证明离线节点上的缓存是否已经自动过期\n\n## 五、人工清除的例外边界\n\n管理员可以按租户清除缓存，但不能按单个用户清除。这是清除粒度的明确限制\n\n因此，在问题只涉及一个用户时，不能把“按单个用户清除”写成可用操作。现有人工清除能力只能以租户为粒度；执行前需要认识到它覆盖的范围大于单个用户。材料没有提供更细粒度的替代方法，也没有说明按租户清除的接口、权限流程或执行结果监控方式\n\n## 六、建议的排查顺序\n\n### 1. 先核对数据库提交\n\n确认数据库提交是否发生。由于事实顺序是“提交在广播之前”，如果提交证据不存在，就不能从广播或缓存状态反推数据库一定已经提交\n\n### 2. 再核对广播发布\n\n确认写入服务是否在数据库提交后发布失效广播。这里要分别保留数据库提交证据和广播发布证据，不能用其中一项替代另一项\n\n### 3. 核对重试边界\n\n如果广播没有按预期送达，检查是否发生重试，并核对：\n\n- 重试次数是否超过“最多 3 次”的范围\n- 相邻重试是否符合“每次间隔 5 秒”的条件\n\n材料没有规定具体日志字段或查询命令；缺少相应记录时，应把结果标为未知，而不是推定重试已经完成\n\n### 4. 核对节点状态与监控口径\n\n确认被检查节点在广播期间是否在线，以及监控中是否存在该节点成功接收广播的证据。需要注意：监控没有覆盖离线节点，所以“监控中没有成功记录”不能单独区分节点离线、广播未送达或其他未说明情况\n\n### 5. 核对缓存键删除结果\n\n对成功接收广播的节点，核对其是否按缓存键删除对应副本。材料只支持按缓存键失效，不支持按用户标识直接失效\n\n### 6. 核对自动过期边界\n\n对于可能错过广播的离线节点，检查对应缓存是否仍处于最长 10 分钟的有效边界内。审计记录应保留实际观察时间与缓存计时证据；如果计时起点不可得，就不能声称已经精确验证“提交后 10 分钟”这一时间关系\n\n### 7. 最后评估人工清除\n\n需要立即扩大处理范围时，可以评估按租户清除；不能尝试或声称按单个用户清除。材料没有规定何时必须执行人工清除，因此是否执行仍需结合现场证据决定\n\n## 七、成功、失败与未知状态的判定\n\n可以确认的状态包括：\n\n- 数据库提交发生在广播之前\n- 边缘节点按缓存键删除副本\n- 广播最多重试 3 次\n- 每次重试间隔 5 秒\n- 离线节点可能错过广播\n- 缓存最长 10 分钟自动过期\n- 人工清除以租户为粒度，不能以单个用户为粒度\n- 监控只统计成功接收广播的在线节点\n\n不能仅凭现有材料确认的内容包括：\n\n- 所有节点都收到广播\n- 离线节点被监控统计\n- 重试后广播最终一定成功\n- 总发送次数及完整恢复时间\n- 自动过期的具体计时起点\n- 按单个用户清除缓存\n\n## 八、审计覆盖记录\n\n基础事实单元如下：\n\n- SRCU-001：数据库提交发生在失效广播之前\n- SRCU-002：边缘节点按缓存键删除副本\n- SRCU-003：广播最多重试 3 次\n- SRCU-004：每次重试间隔 5 秒\n- SRCU-005：离线节点可能错过广播\n- SRCU-006：缓存最长 10 分钟自动过期\n- SRCU-007：管理员可以按租户清除，但不能按单个用户清除\n- SRCU-008：监控只统计成功接收广播的在线节点\n- SRCU-009：复核编号 B35，须保留\n\n覆盖核对段必须独立使用，不能互相替代条件或证据：\n\n- 核对段 1（SRCU-010）：只支持数据库提交发生在广播之前\n- 核对段 2（SRCU-011）：只支持边缘节点按缓存键失效\n- 核对段 3（SRCU-012）：只支持广播最多重试 3 次\n- 核对段 4（SRCU-013）：只支持每次重试间隔 5 秒\n- 核对段 5（SRCU-014）：只支持离线节点可能错过广播\n- 核对段 6（SRCU-015）：只支持缓存最长 10 分钟自动过期\n- 核对段 7（SRCU-016）：只支持人工清除粒度是租户而不是用户\n- 核对段 8（SRCU-017）：只支持监控统计不覆盖离线节点\n- 核对段 9（SRCU-018）：只支持数据库提交发生在广播之前\n- 核对段 10（SRCU-019）：只支持边缘节点按缓存键失效\n- 核对段 11（SRCU-020）：只支持广播最多重试 3 次\n- 核对段 12（SRCU-021）：只支持每次重试间隔 5 秒\n- 核对段 13（SRCU-022）：只支持离线节点可能错过广播\n- 核对段 14（SRCU-023）：只支持缓存最长 10 分钟自动过期\n- 核对段 15（SRCU-024）：只支持人工清除粒度是租户而不是用户\n- 核对段 16（SRCU-025）：只支持监控统计不覆盖离线节点\n\n上述每个核对段都只有其列明的支持范围，不能用某一段替代其他段落的条件或证据。最终审计应分别保存数据库提交、广播发布、重试、节点接收、缓存键删除、自动过期和人工清除的证据；缺少哪一项，就把对应结论标为未知或未验证",
    "answer_sha256": "77444dbb9a2a364db046955ffe9a7bdbc1b683e4607652c7ac937f4c9faa5bef",
    "approved_snapshot_sha256": null,
    "revision_of": null
  },
  "review": {
    "decision_source": "pending_user_review",
    "decision": "pending",
    "reasons": [],
    "correct_parts": [],
    "regression_requirements": [],
    "non_blocking_preferences": [],
    "privacy": {
      "status": "public_safe",
      "basis": "全新合成评测主题，不含用户、服务器、私有项目或凭据数据"
    }
  }
}
