{
  "identity": {
    "case_id": "CANDIDATE-FWD-R2-038-R1",
    "origin_case_id": "FWD-R2-038",
    "status": "candidate",
    "revision": 1,
    "approved_by_user": false,
    "reviewed_at": null,
    "profile_revision_at_review": null
  },
  "task": {
    "audience": "technical_practitioner",
    "augmentation": "GLOSS",
    "base_operation": "EXPLAIN",
    "case_id": "FWD-R2-038",
    "components": [
      "TABLE",
      "TEXT"
    ],
    "content_task": "explanation",
    "core_terms": [
      "接种批次",
      "终点酸度"
    ],
    "genre": "experiment_explanation",
    "input_char_count": 1770,
    "length_class": "extended",
    "references": [
      {
        "content": "实验记录称各批次使用同一接种母液；库存系统却把 B2 记为下一接种批次。负责人尚未签署更正。破折号表示没有 48 小时读数，不代表 pH 为零。终点酸度由另一台仪器测得，该仪器校准在试验前 6 天完成。方案只预先定义比较 30°C 与 34°C 两组平均终点酸度，没有预先定义排除 B2。样本每组只有两个，不能据此概括全部生产批次。",
        "id": "REF-LAB"
      },
      {
        "content": "复核编号 B38，须保留",
        "id": "REF-RESTART"
      },
      {
        "content": "核对段1（事实归属）：两组温度分别为 30°C 与 34°C；本段只支持这项陈述，不能替代其他段落的条件或证据。核对段2（条件边界）：B1 缺少 48 小时 pH；本段只支持这项陈述，不能替代其他段落的条件或证据。核对段3（数值范围）：B2 取样晚 18 分钟；本段只支持这项陈述，不能替代其他段落的条件或证据。核对段4（例外处理）：B2 接种批次来源冲突；本段只支持这项陈述，不能替代其他段落的条件或证据。核对段5（来源状态）：终点酸度仪器校准早于试验 6 天；本段只支持这项陈述，不能替代其他段落的条件或证据。核对段6（可验证结论）：方案未预定义排除 B2；本段只支持这项陈述，不能替代其他段落的条件或证据。核对段7（不可外推内容）：每组只有两个样本；本段只支持这项陈述，不能替代其他段落的条件或证据。核对段8（复核提示）：结论不能外推到全部生产；本段只支持这项陈述，不能替代其他段落的条件或证据。核对段9（事实归属）：两组温度分别为 30°C 与 34°C；本段只支持这项陈述，不能替代其他段落的条件或证据。核对段10（条件边界）：B1 缺少 48 小时 pH；本段只支持这项陈述，不能替代其他段落的条件或证据。核对段11（数值范围）：B2 取样晚 18 分钟；本段只支持这项陈述，不能替代其他段落的条件或证据。核对段12（例外处理）：B2 接种批次来源冲突；本段只支持这项陈述，不能替代其他段落的条件或证据。核对段13（来源状态）：终点酸度仪器校准早于试验 6 天；本段只支持这项陈述，不能替代其他段落的条件或证据。核对段14（可验证结论）：方案未预定义排除 B2；本段只支持这项陈述，不能替代其他段落的条件或证据。核对段15（不可外推内容）：每组只有两个样本；本段只支持这项陈述，不能替代其他段落的条件或证据。核对段16（复核提示）：结论不能外推到全部生产；本段只支持这项陈述，不能替代其他段落的条件或证据。核对段17（事实归属）：两组温度分别为 30°C 与 34°C；本段只支持这项陈述，不能替代其他段落的条件或证据。核对段18（条件边界）：B1 缺少 48 小时 pH；本段只支持这项陈述，不能替代其他段落的条件或证据。核对段19（数值范围）：B2 取样晚 18 分钟；本段只支持这项陈述，不能替代其他段落的条件或证据。核对段20（例外处理）：B2 接种批次来源冲突；本段只支持这项陈述，不能替代其他段落的条件或证据。核对段21（来源状态）：终点酸度仪器校准早于试验 6 天；本段只支持这项陈述，不能替代其他段落的条件或证据。核对段22（可验证结论）：方案未预定义排除 B2；本段只支持这项陈述，不能替代其他段落的条件或证据。核对段23（不可外推内容）：每组只有两个样本；本段只支持这项陈述，不能替代其他段落的条件或证据。核对段24（复核提示）：结论不能外推到全部生产；本段只支持这项陈述，不能替代其他段落的条件或证据。核对段25（事实归属）：两组温度分别为 30°C 与 34°C；本段只支持这项陈述，不能替代其他段落的条件或证据。核对段26（条件边界）：B1 缺少 48 小时 pH；本段只支持这项陈述，不能替代其他段落的条件或证据。",
        "id": "REF-COVERAGE"
      }
    ],
    "request": "保留长表，解释分组、异常值、缺失项、来源冲突和可下结论的范围",
    "round": 2,
    "source": {
      "content": "| 批次 | 温度 | 24h pH | 48h pH | 终点酸度 | 备注 |\n|---|---:|---:|---:|---:|---|\n| A1 | 30°C | 5.2 | 4.6 | 0.71% | 正常 |\n| A2 | 30°C | 5.1 | 4.5 | 0.74% | 正常 |\n| B1 | 34°C | 5.0 | — | 0.82% | 记录器离线 |\n| B2 | 34°C | 5.0 | 4.2 | 0.80% | 取样晚 18 分钟 |",
      "material_type": "table",
      "sha256": "a491aef0a63142bd8ad80991e9a5cf64ba776a29cdbefc84b9a1911d602e762a"
    },
    "topic_id": "TOPIC-R2-038",
    "variation_tags": [
      "conflicting_sources",
      "noisy_input",
      "mixed_format",
      "distributed_condition",
      "numeric_scope",
      "negation_exception"
    ]
  },
  "source": {
    "original_request_sha256": "2f146c4140da0606c63de5ae04f7a56024ae61a5b6d4efc545686102b9c2c6ff",
    "original_answer_sha256": "aa5bb3bbc7a6d0f371617d6a40cdc862c61c04e9aaa2a4e4e578e72d894ad753",
    "source_units": [
      "SRCU-001",
      "SRCU-002",
      "SRCU-003",
      "SRCU-004",
      "SRCU-005",
      "SRCU-006",
      "SRCU-007",
      "SRCU-008",
      "SRCU-009",
      "SRCU-010",
      "SRCU-011",
      "SRCU-012",
      "SRCU-013",
      "SRCU-014",
      "SRCU-015",
      "SRCU-016",
      "SRCU-017"
    ],
    "support_map": [
      "SRCU-001",
      "SRCU-002",
      "SRCU-003",
      "SRCU-004",
      "SRCU-005",
      "SRCU-006",
      "SRCU-007",
      "SRCU-008",
      "SRCU-009",
      "SRCU-010",
      "SRCU-011",
      "SRCU-012",
      "SRCU-013",
      "SRCU-014",
      "SRCU-015",
      "SRCU-016",
      "SRCU-017"
    ],
    "background_claims": [],
    "revision_references": []
  },
  "artifact": {
    "answer": "复核编号：B38\n\n| 批次 | 温度 | 24h pH | 48h pH | 终点酸度 | 备注 |\n|---|---:|---:|---:|---:|---|\n| A1 | 30°C | 5.2 | 4.6 | 0.71% | 正常 |\n| A2 | 30°C | 5.1 | 4.5 | 0.74% | 正常 |\n| B1 | 34°C | 5.0 | — | 0.82% | 记录器离线 |\n| B2 | 34°C | 5.0 | 4.2 | 0.80% | 取样晚 18 分钟 |\n\n### 表格怎么读\n\n每行代表一个实验批次。各列的作用如下：\n\n- “批次”用于识别 A1、A2、B1、B2 四个样本\n- “温度”是分组变量：A1、A2 属于 30°C 组；B1、B2 属于 34°C 组\n- “24h pH”和“48h pH”分别是培养 24 小时、48 小时的 pH 读数\n- “终点酸度”以百分比记录，是方案预先指定用于比较两组平均值的指标；该指标由另一台仪器测得，该仪器在试验前 6 天完成校准\n- “备注”记录数据状态或操作偏差；“正常”仅表示表中未注明异常，“记录器离线”和“取样晚 18 分钟”则标明具体例外\n\n本文中的“接种批次”是指样本所用接种母液的来源批次，它决定不同样本是否具有一致的接种来源。本文中的“终点酸度”是实验结束时记录的酸度百分比，也是本方案预先定义的组间比较指标；它与 pH 是不同的数据列，不能用其中一项替代另一项。\n\n### 分组及数据对应关系\n\n30°C 组包含 A1 和 A2：\n\n- A1 的 pH 从 24 小时的 5.2 降至 48 小时的 4.6，终点酸度为 0.71%，备注为正常\n- A2 的 pH 从 5.1 降至 4.5，终点酸度为 0.74%，备注为正常\n\n34°C 组包含 B1 和 B2：\n\n- B1 的 24 小时 pH 为 5.0，48 小时 pH 缺失，终点酸度为 0.82%；备注给出的缺失背景是记录器离线\n- B2 的 24 小时 pH 为 5.0，48 小时 pH 为 4.2，终点酸度为 0.80%；该批次取样晚了 18 分钟\n\n表中的破折号表示没有取得 48 小时读数，不表示 pH 为零。因此，B1 可以纳入终点酸度的描述和预定平均值计算，但不能用于完整的 48 小时 pH 组间比较。\n\n### 异常项与来源冲突\n\n现有材料没有给出判定统计异常值的规则，也没有预先规定排除 B2。因此，不能仅凭表中数值把 B1 或 B2 判为应删除的“异常值”。需要单独标记的是数据完整性、操作偏差和来源冲突：\n\n- B1 缺少 48 小时 pH，但终点酸度 0.82% 并未缺失\n- B2 取样晚 18 分钟，这是一项操作时点偏差，不等同于其终点酸度 0.80% 已被证明无效\n- 实验记录称所有批次使用同一接种母液，库存系统却把 B2 记为下一接种批次；两项记录相互冲突\n- 负责人尚未签署更正，因此 B2 的接种来源目前仍未正式解决\n\n这些核对材料各自只支持其明确陈述的事实，不能用某一段的确认替代其他条件或证据。例如，仪器校准时间不能解决 B2 的接种来源冲突，B2 的取样偏差也不能自动证明其终点酸度应被排除。\n\n### 数据能够支持什么结论\n\n按照预先定义的比较，可直接计算两组的平均终点酸度：\n\n- 30°C 组平均值为 `(0.71% + 0.74%) ÷ 2 = 0.725%`\n- 34°C 组平均值为 `(0.82% + 0.80%) ÷ 2 = 0.810%`\n- 本次四个样本中，34°C 组比 30°C 组高 0.085 个百分点\n\n因此，严格的表述应是：在本次记录的四个样本中，34°C 组的平均终点酸度高于 30°C 组。这个结果属于样本内的描述性比较，不能直接证明温度造成了差异，原因包括：\n\n- 每组只有两个样本，样本量不足以代表全部生产批次\n- B2 存在未解决的接种批次来源冲突\n- B2 存在取样晚 18 分钟的操作偏差\n- 方案没有预先定义排除 B2，事后直接删除会偏离原定分析范围\n\npH 数据只能作有限描述：30°C 组两个批次均有完整的 24 小时和48 小时读数，34°C 组则缺少 B1 的 48 小时读数。由于方案预先定义的是两组平均终点酸度比较，而不是 pH 比较，不能把表中可见的 pH 变化扩展成预先设定的验证结论。\n\n最终结论不得外推到全部生产。进一步复核时，应先取得负责人签署的 B2 来源更正或其他可核验记录，确认 B2 实际属于哪个接种批次；同时保留 B2 的取样时间偏差，并将“包含 B2 的预定分析”与任何补充的敏感性分析明确分开。",
    "answer_sha256": "aa5bb3bbc7a6d0f371617d6a40cdc862c61c04e9aaa2a4e4e578e72d894ad753",
    "approved_snapshot_sha256": null,
    "revision_of": null
  },
  "review": {
    "decision_source": "pending_user_review",
    "decision": "pending",
    "reasons": [],
    "correct_parts": [],
    "regression_requirements": [],
    "non_blocking_preferences": [],
    "privacy": {
      "status": "public_safe",
      "basis": "全新合成评测主题，不含用户、服务器、私有项目或凭据数据"
    }
  }
}
