{
  "identity": {
    "case_id": "CANDIDATE-FWD-R2-033-R1",
    "origin_case_id": "FWD-R2-033",
    "status": "candidate",
    "revision": 1,
    "approved_by_user": false,
    "reviewed_at": null,
    "profile_revision_at_review": null
  },
  "task": {
    "audience": "technical_practitioner",
    "augmentation": "TEACHING",
    "base_operation": "EXPLAIN",
    "case_id": "FWD-R2-033",
    "components": [
      "TEXT"
    ],
    "content_task": "decision",
    "core_terms": [
      "双写窗口",
      "回退点"
    ],
    "genre": "migration_decision",
    "input_char_count": 936,
    "length_class": "long",
    "references": [
      {
        "content": "运维估计来源于本周会议纪要。",
        "id": "REF-OPS"
      },
      {
        "content": "19 分钟来自上次完整演练日志，时间包含连接重新建立。",
        "id": "REF-DEV"
      },
      {
        "content": "复核编号 B33，须保留",
        "id": "REF-RESTART"
      },
      {
        "content": "核对段1（事实归属）：方案甲计划停写 35 分钟；本段只支持这项陈述，不能替代其他段落的条件或证据。核对段2（条件边界）：业务上限是不超过 20 分钟；本段只支持这项陈述，不能替代其他段落的条件或证据。核对段3（数值范围）：方案乙双写 48 小时；本段只支持这项陈述，不能替代其他段落的条件或证据。核对段4（例外处理）：现有监控无法自动发现字段级差异；本段只支持这项陈述，不能替代其他段落的条件或证据。核对段5（来源状态）：回退时间有 12 与 19 分钟两种来源；本段只支持这项陈述，不能替代其他段落的条件或证据。核对段6（可验证结论）：回退脚本尚未在生产库验证；本段只支持这项陈述，不能替代其他段落的条件或证据。核对段7（不可外推内容）：方案甲计划停写 35 分钟；本段只支持这项陈述，不能替代其他段落的条件或证据。核对段8（复核提示）：业务上限是不超过 20 分钟；本段只支持这项陈述，不能替代其他段落的条件或证据。核对段9（事实归属）：方案乙双写 48 小时；本段只支持这项陈述，不能替代其他段落的条件或证据。核对段10（条件边界）：现有监控无法自动发现字段级差异；本段只支持这项陈述，不能替代其他段落的条件或证据。核对段11（数值范围）：回退时间有 12 与 19 分钟两种来源；本段只支持这项陈述，不能替代其他段落的条件或证据。核对段12（例外处理）：回退脚本尚未在生产库验证；本段只支持这项陈述，不能替代其他段落的条件或证据。核对段13（来源状态）：方案甲计划停写 35 分钟；本段只支持这项陈述，不能替代其他段落的条件或证据。核对段14（可验证结论）：业务上限是不超过 20 分钟；本段只支持这项陈述，不能替代其他段落的条件或证据。",
        "id": "REF-COVERAGE"
      }
    ],
    "request": "从零解释迁移选项并给出有条件建议，不隐藏冲突证据",
    "round": 2,
    "source": {
      "content": "方案甲在周六 01:00 停写 35 分钟，验证完成后切换；方案乙连续双写 48 小时，不停写，但现有监控不能自动发现两端字段级差异。运维估计甲回退需 12 分钟，开发记录显示上次演练用了 19 分钟。业务要求任何单次不可写不超过 20 分钟。回退脚本只在测试库验证过。",
      "material_type": "text",
      "sha256": "eb09b73e3cf1bc3e4c889481286be3cdb03e63bcc59aec26d024738c9cda5a24"
    },
    "topic_id": "TOPIC-R2-033",
    "variation_tags": [
      "conflicting_sources",
      "distributed_condition",
      "numeric_scope",
      "urgency_or_emotion"
    ]
  },
  "source": {
    "original_request_sha256": "cc97d5865ee600b6177d790dbf420356c51006f027b72aaee7c19fcd7c90ccac",
    "original_answer_sha256": "cb17c8ed3a0e3f021e7e4ea50e4762a5e135c409c9f7095b68d44054e35ccb3e",
    "source_units": [
      "SRCU-001",
      "SRCU-002",
      "SRCU-003",
      "SRCU-004",
      "SRCU-005",
      "SRCU-006",
      "SRCU-007",
      "SRCU-008",
      "SRCU-009",
      "SRCU-010"
    ],
    "support_map": [
      "SRCU-001",
      "SRCU-002",
      "SRCU-003",
      "SRCU-004",
      "SRCU-005",
      "SRCU-006",
      "SRCU-007",
      "SRCU-008",
      "SRCU-009",
      "SRCU-010"
    ],
    "background_claims": [
      {
        "claim": "运维提出的 12 分钟回退时间是估计值，来源于本周会议纪要",
        "source_reference": "REF-OPS"
      },
      {
        "claim": "19 分钟来自上次完整演练日志，并包含连接重新建立时间",
        "source_reference": "REF-DEV"
      },
      {
        "claim": "复核编号 B33，须保留",
        "source_reference": "REF-RESTART"
      }
    ],
    "revision_references": []
  },
  "artifact": {
    "answer": "## 结论\n\n当前条件下，方案甲不应直接执行：它计划停写 35 分钟，明确超过业务规定的“任何单次不可写不超过 20 分钟”上限\n\n有条件建议选择方案乙，但前提是先补齐字段级差异核对和可验证的回退方案；如果这些前提无法在迁移前满足，则两个方案目前都不具备执行条件，应推迟迁移，而不是接受未量化的数据不一致风险\n\n## 两个方案分别怎样工作\n\n- 方案甲：周六 01:00 停止写入，计划停写 35 分钟，完成验证后再切换\n  - 优点是切换前可以在静止数据上验证\n  - 决定性问题是 35 分钟停写已经超过 20 分钟业务上限；即使回退本身可能在 20 分钟内完成，也不能消除主流程停写超限的问题\n\n- 方案乙：连续双写 48 小时，不停止写入\n  - “双写窗口”是指这 48 小时内，同一批业务写入同时送往迁移前后的两端，用来维持两端数据并为后续切换提供观察期\n  - 它避免了方案甲预先计划的 35 分钟停写，但现有监控不能自动发现两端的字段级差异；因此，“没有报警”不能证明两端字段一致\n\n## 回退证据为什么存在冲突\n\n方案甲的回退时间有两个来源，不能合并成一个看似确定的数字：\n\n- 运维估计为 12 分钟，来源是本周会议纪要\n- 开发记录为 19 分钟，来源是上次完整演练日志，而且该时间包含连接重新建立\n\n做容量和风险判断时，建议暂按 19 分钟作为较保守的参考值，因为它来自一次完整演练；但这仍不是生产环境保证值。19 分钟距离 20 分钟业务上限只剩 1 分钟余量，而且回退脚本只在测试库验证过，尚未在生产库验证\n\n这里的“回退点”是迁移过程中允许停止继续切换、并返回原状态的明确检查节点。一个可执行的回退点至少要回答：何时触发回退、回到哪一侧、采用哪份数据、脚本需要多久，以及回退后如何确认写入已经恢复。现有材料只给出了 12 分钟与 19 分钟两种时间证据，尚不足以证明生产环境可以在 20 分钟内可靠完成回退\n\n## 选择方案乙必须满足的条件\n\n- 在 48 小时双写窗口开始前，建立字段级差异核对方法；它需要能够发现两端同一记录的字段值不一致，不能只依赖现有监控是否报警\n- 为差异核对规定执行频率、允许阈值和处置责任；发现差异时，应能停止切换并进入回退判断\n- 明确回退点及其触发条件，并在接近生产条件的环境中完整演练回退脚本，包括连接重新建立\n- 为双写窗口设置退出标准：48 小时结束并不自动代表可以切换，只有字段级核对达到既定标准、未解决差异已经清零或得到明确接受，才可继续\n- 如果任何步骤会造成不可写，必须单独证明该次不可写不超过 20 分钟；不能用“方案整体不停写”掩盖局部停写\n\n因此，最终决策是：满足上述条件时采用方案乙；条件未满足时推迟迁移。方案甲只有在把计划停写时间降到不超过 20 分钟，并完成生产适用的回退验证后，才值得重新评估\n\n复核编号 B33，须保留",
    "answer_sha256": "cb17c8ed3a0e3f021e7e4ea50e4762a5e135c409c9f7095b68d44054e35ccb3e",
    "approved_snapshot_sha256": null,
    "revision_of": null
  },
  "review": {
    "decision_source": "pending_user_review",
    "decision": "pending",
    "reasons": [],
    "correct_parts": [],
    "regression_requirements": [],
    "non_blocking_preferences": [],
    "privacy": {
      "status": "public_safe",
      "basis": "全新合成评测主题，不含用户、服务器、私有项目或凭据数据"
    }
  }
}
