{
  "identity": {
    "case_id": "CANDIDATE-FWD-R2-040-R1",
    "origin_case_id": "FWD-R2-040",
    "status": "candidate",
    "revision": 1,
    "approved_by_user": false,
    "reviewed_at": null,
    "profile_revision_at_review": null
  },
  "task": {
    "audience": "auditor",
    "augmentation": "GLOSS",
    "base_operation": "TRANSFORM",
    "case_id": "FWD-R2-040",
    "components": [
      "TEXT"
    ],
    "content_task": "audit",
    "core_terms": [
      "法律保留",
      "删除队列"
    ],
    "genre": "policy_audit",
    "input_char_count": 1791,
    "length_class": "extended",
    "references": [
      {
        "content": "生产配置快照仍显示 default_days=30、security_days=90，快照时间为 2026-09-30 22:00 UTC。",
        "id": "REF-CONFIG"
      },
      {
        "content": "部署工单计划在 2026-10-01 00:00 UTC 将 default_days 改为 14；现无部署完成日志。",
        "id": "REF-TICKET"
      },
      {
        "content": "复核编号 B40，须保留",
        "id": "REF-RESTART"
      },
      {
        "content": "核对段1（事实归属）：普通导出新规则是 14 天；本段只支持这项陈述，不能替代其他段落的条件或证据。核对段2（条件边界）：规则只适用于指定生效时间后创建的文件；本段只支持这项陈述，不能替代其他段落的条件或证据。核对段3（数值范围）：既有文件保持 30 天；本段只支持这项陈述，不能替代其他段落的条件或证据。核对段4（例外处理）：安全事件导出保留 90 天；本段只支持这项陈述，不能替代其他段落的条件或证据。核对段5（来源状态）：法律保留优先且不删除；本段只支持这项陈述，不能替代其他段落的条件或证据。核对段6（可验证结论）：删除队列每 6 小时执行；本段只支持这项陈述，不能替代其他段落的条件或证据。核对段7（不可外推内容）：入队不等于物理删除；本段只支持这项陈述，不能替代其他段落的条件或证据。核对段8（复核提示）：配置快照早于计划切换；本段只支持这项陈述，不能替代其他段落的条件或证据。核对段9（事实归属）：缺少部署完成日志；本段只支持这项陈述，不能替代其他段落的条件或证据。核对段10（条件边界）：不能声称 14 天配置已经生效；本段只支持这项陈述，不能替代其他段落的条件或证据。核对段11（数值范围）：普通导出新规则是 14 天；本段只支持这项陈述，不能替代其他段落的条件或证据。核对段12（例外处理）：规则只适用于指定生效时间后创建的文件；本段只支持这项陈述，不能替代其他段落的条件或证据。核对段13（来源状态）：既有文件保持 30 天；本段只支持这项陈述，不能替代其他段落的条件或证据。核对段14（可验证结论）：安全事件导出保留 90 天；本段只支持这项陈述，不能替代其他段落的条件或证据。核对段15（不可外推内容）：法律保留优先且不删除；本段只支持这项陈述，不能替代其他段落的条件或证据。核对段16（复核提示）：删除队列每 6 小时执行；本段只支持这项陈述，不能替代其他段落的条件或证据。核对段17（事实归属）：入队不等于物理删除；本段只支持这项陈述，不能替代其他段落的条件或证据。核对段18（条件边界）：配置快照早于计划切换；本段只支持这项陈述，不能替代其他段落的条件或证据。核对段19（数值范围）：缺少部署完成日志；本段只支持这项陈述，不能替代其他段落的条件或证据。核对段20（例外处理）：不能声称 14 天配置已经生效；本段只支持这项陈述，不能替代其他段落的条件或证据。核对段21（来源状态）：普通导出新规则是 14 天；本段只支持这项陈述，不能替代其他段落的条件或证据。核对段22（可验证结论）：规则只适用于指定生效时间后创建的文件；本段只支持这项陈述，不能替代其他段落的条件或证据。核对段23（不可外推内容）：既有文件保持 30 天；本段只支持这项陈述，不能替代其他段落的条件或证据。核对段24（复核提示）：安全事件导出保留 90 天；本段只支持这项陈述，不能替代其他段落的条件或证据。核对段25（事实归属）：法律保留优先且不删除；本段只支持这项陈述，不能替代其他段落的条件或证据。核对段26（条件边界）：删除队列每 6 小时执行；本段只支持这项陈述，不能替代其他段落的条件或证据。核对段27（数值范围）：入队不等于物理删除；本段只支持这项陈述，不能替代其他段落的条件或证据。核对段28（例外处理）：配置快照早于计划切换；本段只支持这项陈述，不能替代其他段落的条件或证据。核对段29（来源状态）：缺少部署完成日志；本段只支持这项陈述，不能替代其他段落的条件或证据。",
        "id": "REF-COVERAGE"
      }
    ],
    "request": "合并多轮政策材料，形成可审计说明；指出失效旧要求、冲突来源和证据缺口",
    "round": 2,
    "source": {
      "content": [
        "初版：普通导出文件保留 30 天，之后进入删除队列；法律保留对象不删除。",
        "修订一：普通导出改为 14 天；已经创建的文件仍按 30 天。",
        "修订二：安全事件导出保留 90 天；若同时属于法律保留，以法律保留为准。",
        "最新澄清：14 天规则从 2026-10-01 00:00 UTC 创建的文件开始；删除队列每 6 小时执行，进入队列不代表已经物理删除。"
      ],
      "material_type": "multi_turn",
      "sha256": "20a30cff54222a05e39184f37042d377c1ae450ad2a5c3bbbc5867e8fbeead4b"
    },
    "topic_id": "TOPIC-R2-040",
    "variation_tags": [
      "correction_turn",
      "conflicting_sources",
      "noisy_input",
      "distributed_condition",
      "mixed_format",
      "numeric_scope",
      "negation_exception",
      "urgency_or_emotion"
    ]
  },
  "source": {
    "original_request_sha256": "50479d7b2021cc29a98befb3ca10ad83f96e727c5260d6d77272d2abbf26c074",
    "original_answer_sha256": "829e72c90cff90fd4a7f6114a69e5a82dc856f8b70ddd21af8bf832590f27675",
    "source_units": [
      "SRCU-001",
      "SRCU-002",
      "SRCU-003",
      "SRCU-004",
      "SRCU-005",
      "SRCU-006",
      "SRCU-007",
      "SRCU-008",
      "SRCU-009",
      "SRCU-010"
    ],
    "support_map": [
      "SRCU-001",
      "SRCU-002",
      "SRCU-003",
      "SRCU-004",
      "SRCU-005",
      "SRCU-006",
      "SRCU-007",
      "SRCU-008",
      "SRCU-009",
      "SRCU-010"
    ],
    "background_claims": [
      {
        "claim": "生产配置快照显示 default_days=30、security_days=90，快照时间为 2026-09-30 22:00 UTC。",
        "source_reference": "REF-CONFIG"
      },
      {
        "claim": "部署工单计划在 2026-10-01 00:00 UTC 将 default_days 改为 14。",
        "source_reference": "REF-TICKET"
      },
      {
        "claim": "目前没有部署完成日志。",
        "source_reference": "REF-TICKET"
      },
      {
        "claim": "配置快照早于计划切换时间，不能据此证明 14 天配置已经生效。",
        "source_reference": "REF-COVERAGE"
      },
      {
        "claim": "覆盖核对材料分别确认普通导出新规则为 14 天、生效时间边界、既有文件保持 30 天、安全事件导出保留 90 天、法律保留优先且不删除、删除队列每 6 小时执行、入队不等于物理删除，以及部署完成日志缺失。",
        "source_reference": "REF-COVERAGE"
      },
      {
        "claim": "覆盖核对材料中的各段只支持对应的单项陈述，不能替代其他段落的条件或证据。",
        "source_reference": "REF-COVERAGE"
      },
      {
        "claim": "复核编号 B40 须保留。",
        "source_reference": "REF-RESTART"
      }
    ],
    "revision_references": []
  },
  "artifact": {
    "answer": "审计结论\n\n政策规则已经完成修订，但生产配置是否按计划切换仍缺少证据。普通导出的有效规则是：2026-10-01 00:00 UTC 以前创建的文件保留 30 天，自该时间起创建的文件保留 14 天；安全事件导出保留 90 天；任何文件一旦属于法律保留对象，均不得删除。保留期届满只表示文件可以进入删除队列，不能据此认定文件已经物理删除。\n\n一、当前有效要求\n\n- 普通导出：\n  - 2026-10-01 00:00 UTC 以前创建的文件继续保留 30 天\n  - 2026-10-01 00:00 UTC 起创建的文件保留 14 天\n- 安全事件导出保留 90 天\n- 法律保留优先于普通导出和安全事件导出的保留期限；“法律保留”在本政策中是阻止文件按常规期限删除的覆盖条件，适用后文件不得删除\n- 文件达到适用的保留期限后进入删除队列；“删除队列”是等待删除处理的调度环节，每 6 小时执行一次，但入队不等于物理删除已经完成\n\n二、失效或被限定的旧要求\n\n- 初版“普通导出文件保留 30 天”的无条件表述已经失效。30 天不再适用于所有普通导出，只继续适用于 2026-10-01 00:00 UTC 以前创建的既有文件\n- 修订一中未注明生效边界的“普通导出改为 14 天”已被最新澄清限定。14 天规则不能追溯适用于此前创建的文件\n- 初版关于保留期届满后进入删除队列的处理路径仍然有效，但必须与“删除队列每 6 小时执行”和“入队不等于物理删除”一并理解\n- 初版关于法律保留对象不删除的要求仍然有效，并由修订二进一步明确为优先规则\n\n三、来源冲突与状态判断\n\n政策材料规定普通导出新规则为 14 天；生产配置快照却仍显示 `default_days=30`，同时显示 `security_days=90`，快照时间为 2026-09-30 22:00 UTC [REF-CONFIG]。部署工单计划在 2026-10-01 00:00 UTC 把 `default_days` 改为 14，但目前没有部署完成日志 [REF-TICKET]。\n\n这不是能够直接认定的同一时点配置冲突：配置快照比计划切换时间早 2 小时，因此快照中的 30 天与切换前规则一致。不过，现有证据只能证明切换前的配置状态和部署计划，不能证明计划切换实际完成，也不能声称生产环境中的 14 天配置已经生效。`security_days=90` 与安全事件导出保留 90 天的政策一致，但该快照不能证明法律保留覆盖、删除队列执行周期或物理删除状态。\n\n覆盖核对材料也分别确认了新旧期限、生效边界、安全事件例外、法律保留优先、删除队列周期、入队与物理删除的区别，以及部署证据缺口；各核对段只支持其对应的单项陈述，不能替代其他条件或证据 [REF-COVERAGE]。\n\n四、证据缺口与复核要求\n\n当前仍需取得以下证据：\n\n- 2026-10-01 00:00 UTC 以后生成的部署完成日志，用于确认 `default_days` 是否已从 30 改为 14\n- 切换后的生产配置快照或运行时配置查询结果，用于确认实际生效值及其生效时间\n- 删除队列的调度配置和执行日志，用于验证每 6 小时执行一次，而不是仅依据政策文本认定运行状态\n- 文件状态或删除执行记录，用于区分“已入队”“删除处理中”和“已物理删除”\n- 法律保留对象的命中与排除记录，用于验证受法律保留约束的文件确实未进入实际删除流程\n\n在上述证据补齐前，可审计结论应写为：“14 天规则已经形成明确政策要求，计划自 2026-10-01 00:00 UTC 起适用于新创建的普通导出文件；现有生产快照早于计划切换时间，且缺少部署完成日志，因此实际配置切换状态尚不能确认。”复核编号 B40 须保留 [REF-RESTART]。",
    "answer_sha256": "829e72c90cff90fd4a7f6114a69e5a82dc856f8b70ddd21af8bf832590f27675",
    "approved_snapshot_sha256": null,
    "revision_of": null
  },
  "review": {
    "decision_source": "pending_user_review",
    "decision": "pending",
    "reasons": [],
    "correct_parts": [],
    "regression_requirements": [],
    "non_blocking_preferences": [],
    "privacy": {
      "status": "public_safe",
      "basis": "全新合成评测主题，不含用户、服务器、私有项目或凭据数据"
    }
  }
}
