{
  "identity": {
    "case_id": "GOLD-FWD-R1-003-R2",
    "origin_case_id": "FWD-R1-003",
    "status": "gold",
    "revision": 2,
    "approved_by_user": true,
    "reviewed_at": "2026-08-31",
    "profile_revision_at_review": "round-4-generalization"
  },
  "task": {
    "audience": "zero_prior_knowledge",
    "augmentation": "NONE",
    "base_operation": "COMPRESS",
    "case_id": "FWD-R1-003",
    "components": [
      "TEXT"
    ],
    "genre": "project_update",
    "references": [],
    "request": "压缩成一段项目进展，保留每个数字、未完成项和下一步",
    "round": 1,
    "source": {
      "content": "团队检查了 42 个页面，其中 39 个页面显示正常，3 个页面的移动端导航遮挡正文。桌面端没有发现遮挡。修复尚未部署。下一步是在 360 像素和 390 像素宽度下复测这 3 个页面。",
      "material_type": "text",
      "sha256": "172a147acc0844525ce8a1cfa5bf699c6e72a9506570f1b27ac56cfffdb642ec"
    }
  },
  "source": {
    "original_request_sha256": "cd0bf516b47346ad959f2bb6158c5e9e362e8248889fc85b56e0cfea6cd5be57",
    "original_answer_sha256": "2a8638c8db43f193a0f667cdd874034f85c158592d7fd0dbbe2090f56ee899e0",
    "source_units": [
      "SRCU-001",
      "SRCU-002",
      "SRCU-003",
      "SRCU-004",
      "SRCU-005",
      "SRCU-006"
    ],
    "support_map": [
      "SRCU-001",
      "SRCU-002",
      "SRCU-003",
      "SRCU-004",
      "SRCU-005",
      "SRCU-006"
    ],
    "background_claims": [],
    "revision_references": []
  },
  "artifact": {
    "answer": "团队共检查 42 个页面，其中 39 个显示正常，另有 3 个页面的移动端导航会遮挡正文，桌面端未发现遮挡\n\n修复尚未部署，下一步是在 360 像素和 390 像素宽度下复测这 3 个页面",
    "answer_sha256": "658c0b226d016589af5fd3d81309dc436919cf7df7cac12c0f473c35ca692012",
    "approved_snapshot_sha256": "658c0b226d016589af5fd3d81309dc436919cf7df7cac12c0f473c35ca692012",
    "revision_of": "REJECTED-FWD-R1-003"
  },
  "review": {
    "decision_source": "explicit_user_review",
    "decision": "accepted",
    "reasons": [
      "用户明确接受当前 R2，可以原样进入 Gold"
    ],
    "correct_parts": [
      "原始答案中未被用户否定的事实、数字、条件和证据边界继续保留"
    ],
    "regression_requirements": [
      "压缩减少重复文字，不应删除主题之间的必要换行"
    ],
    "non_blocking_preferences": [],
    "privacy": {
      "status": "public_safe",
      "basis": "只保存脱敏技术反馈，不保存原始对话、账户信息或个人路径"
    }
  }
}
